{
	"schemaVersion": 1,
	"stage": "stage-11-release",
	"capturedAt": "2026-08-07T20:06:27Z",
	"run": {
		"id": "stage11-20260807t193030z-decc5016",
		"logRoot": "evidence/stage-11-release-run",
		"collector": "scripts/template/collect-stage-eleven-evidence.ts"
	},
	"source": {
		"baseSha": "28f69975f133fb04b203e61709fa543614ede89d",
		"implementationSha": "0ed8066a309af92caaebc820b9f074e26b66b969",
		"treeClean": true
	},
	"host": {
		"os": "darwin",
		"architecture": "arm64",
		"kernel": "25.5.0",
		"insideDevcontainer": false,
		"bunVersion": "1.3.13",
		"gitVersion": "2.50.1 (Apple Git-155)",
		"dockerVersion": "29.4.0"
	},
	"repository": {
		"nameWithOwner": "MrChrisRodriguez/devenv",
		"workflowFile": ".github/workflows/ci.yml",
		"gateJobId": "ci-gate",
		"gateContext": "CI gate",
		"gateNeeds": [
			"ci",
			"image",
			"affected",
			"project",
			"moon-graph",
			"browser"
		],
		"releaseGuardScript": "template:release-check",
		"releaseSyncScript": "template:release-sync",
		"registryFile": "release.json",
		"capability": null,
		"imageTarget": "development",
		"addedJobs": 0,
		"devcontainerFilesChanged": 0,
		"lockfileBytesChanged": 0
	},
	"release": {
		"decision": "candidate",
		"plannedTag": "v1.0.0",
		"changeName": "portable-devcontainer-upgrade",
		"scanFamilies": 6,
		"acceptanceItems": 10,
		"acceptanceLive": 7,
		"acceptanceInherited": 3,
		"budgetFamilies": 4,
		"goldenFixtures": 3,
		"goldenTotalFileCount": 428,
		"goldenDigests": [
			{
				"path": "fixtures/golden/cloud.json",
				"sha256": "7616f353750728d5d35bcca87d15dfde05b48a168bf20861521e1668fa28ef1c",
				"fileCount": 127
			},
			{
				"path": "fixtures/golden/full.json",
				"sha256": "a1225f5023ec844af72fc9dfc9b77ae1263e9798afba02ddaf99a65dca4f3063",
				"fileCount": 176
			},
			{
				"path": "fixtures/golden/minimal.json",
				"sha256": "f4f5f6379d69f936a62ac7d7d46465d56f6c57e09eddce678022d2a0566ef37e",
				"fileCount": 125
			}
		],
		"postMergeSteps": [
			"pr-merges",
			"default-branch-full-run-green",
			"tag-merge-commit",
			"push-tag",
			"archive-change"
		]
	},
	"commands": [
		{
			"id": "release-guard",
			"runId": "stage11-20260807t193030z-decc5016",
			"command": ["bun", "run", "template:release-check"],
			"cwd": ".",
			"exitCode": 0,
			"status": "pass",
			"durationMs": 1295,
			"stdoutPath": "evidence/stage-11-release-run/release-guard.stdout",
			"stdoutSha256": "41ad3f7e5135d9098e9435a6a78978baa8a98928bb392ab9a1523cfb5a66e6d4",
			"stderrPath": "evidence/stage-11-release-run/release-guard.stderr",
			"stderrSha256": "32d1867eb94cd78da8ad62a947ec5b23b62e13e7ed338424d76302fe831ae2ca"
		},
		{
			"id": "goldens",
			"runId": "stage11-20260807t193030z-decc5016",
			"command": ["bun", "run", "template:release-sync"],
			"cwd": ".",
			"exitCode": 0,
			"status": "pass",
			"durationMs": 788,
			"stdoutPath": "evidence/stage-11-release-run/goldens.stdout",
			"stdoutSha256": "711a80b9d77aa5d5735e20ab26da98ae936c3d4072c330c0d4929e90e12b316d",
			"stderrPath": "evidence/stage-11-release-run/goldens.stderr",
			"stderrSha256": "ff80384a03c1bbdb56ef371bfda88183bc9d047a920959cd267b701c56334512"
		},
		{
			"id": "golden-mutation",
			"runId": "stage11-20260807t193030z-decc5016",
			"command": [
				"bash",
				"scripts/template/capture-stage-eleven.sh",
				"golden-mutation"
			],
			"cwd": ".",
			"exitCode": 0,
			"status": "pass",
			"durationMs": 5340,
			"stdoutPath": "evidence/stage-11-release-run/golden-mutation.stdout",
			"stdoutSha256": "9473fe53d8950f1b6061bad4bec1560dd8ed1fc30e0641f2bcc85ed36985a028",
			"stderrPath": "evidence/stage-11-release-run/golden-mutation.stderr",
			"stderrSha256": "7292d602787769c76e932e4c168588381efb55a910a6ecb0c0ab4826dce72df9"
		},
		{
			"id": "scans",
			"runId": "stage11-20260807t193030z-decc5016",
			"command": ["bash", "scripts/template/capture-stage-eleven.sh", "scans"],
			"cwd": ".",
			"exitCode": 0,
			"status": "pass",
			"durationMs": 50,
			"stdoutPath": "evidence/stage-11-release-run/scans.stdout",
			"stdoutSha256": "a3d57d9a6e4935155703b2c0c0368ef1b2f5f7f4b61b044017fcef16773deb0c",
			"stderrPath": "evidence/stage-11-release-run/scans.stderr",
			"stderrSha256": "99b5a1e30ace2cca09c07843769bdea64fd893eb3d7baeee122165f7af43a514"
		},
		{
			"id": "acceptance-inheritance",
			"runId": "stage11-20260807t193030z-decc5016",
			"command": [
				"bash",
				"scripts/template/capture-stage-eleven.sh",
				"acceptance-inheritance"
			],
			"cwd": ".",
			"exitCode": 0,
			"status": "pass",
			"durationMs": 985,
			"stdoutPath": "evidence/stage-11-release-run/acceptance-inheritance.stdout",
			"stdoutSha256": "cd9c1117d9fb3090611408f5031a38a2d5427f4b3cbecea3ff6fde402ad0ad77",
			"stderrPath": "evidence/stage-11-release-run/acceptance-inheritance.stderr",
			"stderrSha256": "bac4f1a1845a458699df3725385631f007af00bf607d9fa1113635f7acb83992"
		},
		{
			"id": "budgets",
			"runId": "stage11-20260807t193030z-decc5016",
			"command": [
				"bash",
				"scripts/template/capture-stage-eleven.sh",
				"budgets"
			],
			"cwd": ".",
			"exitCode": 0,
			"status": "pass",
			"durationMs": 36,
			"stdoutPath": "evidence/stage-11-release-run/budgets.stdout",
			"stdoutSha256": "d0229bea88e800b627f4e67c07260400f5abd3a7717ce993a0449ce5ac53d6c3",
			"stderrPath": "evidence/stage-11-release-run/budgets.stderr",
			"stderrSha256": "85afbd5faf08104e1c63021f614c5d8833fb61ca42e889e38b2de4c7a0c81daa"
		},
		{
			"id": "signals",
			"runId": "stage11-20260807t193030z-decc5016",
			"command": [
				"bash",
				"scripts/template/capture-stage-eleven.sh",
				"signals"
			],
			"cwd": ".",
			"exitCode": 0,
			"status": "pass",
			"durationMs": 75,
			"stdoutPath": "evidence/stage-11-release-run/signals.stdout",
			"stdoutSha256": "40cd96db25ff8c0082d4241d868efad36c9c1769ac0696065f7cc2f230074894",
			"stderrPath": "evidence/stage-11-release-run/signals.stderr",
			"stderrSha256": "30dd42030612edff057d3b223780a608070a3b560cd0bf3a115ad6bcbb742d68"
		},
		{
			"id": "render-fixtures",
			"runId": "stage11-20260807t193030z-decc5016",
			"command": [
				"bash",
				"scripts/template/capture-stage-eleven.sh",
				"render-fixtures"
			],
			"cwd": ".",
			"exitCode": 0,
			"status": "pass",
			"durationMs": 593,
			"stdoutPath": "evidence/stage-11-release-run/render-fixtures.stdout",
			"stdoutSha256": "b19f311407cb47923e9a7547a6444f72a597f16b06c831932e5cb3650fe42470",
			"stderrPath": "evidence/stage-11-release-run/render-fixtures.stderr",
			"stderrSha256": "546dd51f941fa0b4b8157eaf286e72ecf261f70b619c56f8da28432b777284e7"
		},
		{
			"id": "release-mutations",
			"runId": "stage11-20260807t193030z-decc5016",
			"command": [
				"bash",
				"scripts/template/capture-stage-eleven.sh",
				"release-mutations"
			],
			"cwd": ".",
			"exitCode": 0,
			"status": "pass",
			"durationMs": 11783,
			"stdoutPath": "evidence/stage-11-release-run/release-mutations.stdout",
			"stdoutSha256": "a988004fe889489ae99d7c18543ce0f714da9aab661e90caa46e19a2a411535d",
			"stderrPath": "evidence/stage-11-release-run/release-mutations.stderr",
			"stderrSha256": "e8958696002cbfbb1782b714f4455618e01a8f45204467e477becd9518289fb5"
		},
		{
			"id": "clean-image-build",
			"runId": "stage11-20260807t193030z-decc5016",
			"command": [
				"docker",
				"build",
				"--progress=plain",
				"--no-cache",
				"--target",
				"development",
				"-f",
				".devcontainer/Dockerfile",
				"-t",
				"devenv-stage11:clean",
				"."
			],
			"cwd": ".",
			"exitCode": 0,
			"status": "pass",
			"durationMs": 118603,
			"stdoutPath": "evidence/stage-11-release-run/clean-image-build.stdout",
			"stdoutSha256": "f05c4fcf2e27a9a1004702da294ee36b38f22235dd58591840cb11dffec7a7ed",
			"stderrPath": "evidence/stage-11-release-run/clean-image-build.stderr",
			"stderrSha256": "ddd9dc2e96c3383b1fbd841cab8c140b38eeaaa5021ba0d90513ac1e55faffc1"
		},
		{
			"id": "warm-image-build",
			"runId": "stage11-20260807t193030z-decc5016",
			"command": [
				"docker",
				"build",
				"--progress=plain",
				"--target",
				"development",
				"-f",
				".devcontainer/Dockerfile",
				"-t",
				"devenv-stage11:clean",
				"."
			],
			"cwd": ".",
			"exitCode": 0,
			"status": "pass",
			"durationMs": 6392,
			"stdoutPath": "evidence/stage-11-release-run/warm-image-build.stdout",
			"stdoutSha256": "410853872801d88fc0c7c0ae8cf3d89018431fb58447fe3995d5a41d51cb0bbf",
			"stderrPath": "evidence/stage-11-release-run/warm-image-build.stderr",
			"stderrSha256": "9f373bb9616dc1c59e77091a5eb2f264f9a2989ff28cc0867d303328b3cdd0c6"
		},
		{
			"id": "fresh-startup",
			"runId": "stage11-20260807t193030z-decc5016",
			"command": [
				"bash",
				"scripts/template/capture-stage-eleven.sh",
				"fresh-startup"
			],
			"cwd": ".",
			"exitCode": 0,
			"status": "pass",
			"durationMs": 124097,
			"stdoutPath": "evidence/stage-11-release-run/fresh-startup.stdout",
			"stdoutSha256": "3715863535070a3a2989554b751bbb83ce7d01cd667f97213ba922c23a4999fd",
			"stderrPath": "evidence/stage-11-release-run/fresh-startup.stderr",
			"stderrSha256": "f3f2bd55cf44d044355c44b81e687b46ee82c9bb731365f38f232bd8bd1b5aeb"
		},
		{
			"id": "two-worktree-isolation",
			"runId": "stage11-20260807t193030z-decc5016",
			"command": [
				"bash",
				"scripts/template/capture-stage-eleven.sh",
				"two-worktree-isolation"
			],
			"cwd": ".",
			"exitCode": 0,
			"status": "pass",
			"durationMs": 44677,
			"stdoutPath": "evidence/stage-11-release-run/two-worktree-isolation.stdout",
			"stdoutSha256": "80eb16731118a300a696f333a8d29bc7bae7955b74bd1ab17c9ea473a2356db6",
			"stderrPath": "evidence/stage-11-release-run/two-worktree-isolation.stderr",
			"stderrSha256": "e3b0c44298fc1c149afbf4c8996fb92427ae41e4649b934ca495991b7852b855"
		},
		{
			"id": "browser-image-build",
			"runId": "stage11-20260807t193030z-decc5016",
			"command": [
				"docker",
				"build",
				"--progress=plain",
				"--target",
				"development_browser",
				"-f",
				".devcontainer/Dockerfile",
				"-t",